{
  "$schema":"https://json-schema.org/draft/2020-12/schema","type":"object","additionalProperties":false,
  "required":["schema_version","kind","proposal_sha256","research_scope_key","passport_hash","entry_sha256","published_at","producer_release_sha256","receipt_sha256"],
  "properties":{
    "schema_version":{"const":"1.0.0"},"kind":{"const":"qrgf_v4_registry_write_receipt"},"proposal_sha256":{"type":"string"},"research_scope_key":{"type":"string"},"passport_hash":{"type":"string"},"entry_sha256":{"type":"string"},"published_at":{"type":"string"},"producer_release_sha256":{"type":"string"},"receipt_sha256":{"type":"string"}
  }
}
